{
  "case_id": "rolling_extreme_min",
  "spec_version": "1.0.0",
  "target": {"kind": "function", "id": "rolling_extreme", "params": {"field": "low", "weeks": 1, "op": "min"}},
  "description": "Trailing-window minimum over [date - weeks*7d, date], inclusive. weeks=1 for hand-computability; the 52w-low feature binds weeks=52.",
  "input_file": "input_bars.csv",
  "expected_file": "expected.csv",
  "tolerance": {"abs": 1e-9, "rel": 0.0},
  "null_token": ""
}
